source,title,article_body,collect_time,link,good,nice,sad,angry,wanted,recommand,press
naver_news,"42.5% vs 32.4%…文대통령 지지율, 왜 이리 다를까?","온라인 뉴스의 강자 머니투데이가 그 날의 가장 뜨거웠던 이슈를 선정해 다양한 각도에서 조명해드립니다. 어떤 이슈들이 온라인 세상을 달구고 있는지 [MT이슈+]를 통해 확인하시기 바랍니다.문재인 대통령./사진=뉴시스 문재인 대통령./사진=뉴시스━━━━━━[머니투데이 남형도 기자] [편집자주] ﻿[[MT이슈+]'잘 모르겠다' 문항 하나에 갈리는 여론조사 심리, 잘 이해하고 들여다봐야]대통령 지지율 여론조사마다 등장하는 '단골 댓글'이 있다. ""XX에서 한 조사에선 몇%라던데""란 식이다. 조사 결과에 대한 의문 제기이며, 나아가 불신(不愼)하는 경우도 생긴다. 같은 내용을 묻는 것인데 결과가 왜 이리 다르냐는 거다.최근 문재인 대통령 지지율을 놓고서도 말이 많았다. 비슷한 시기에 리얼미터(tbs 의뢰, 10월2주차)에선 42.5%가, 내일신문과 서강대 현대정치연구소 여론조사에선 32.4%가 나왔다. '40%대'가 깨졌느냐를 판가름하는 일이라, 이를 바라보는 여론도 민감했다. 대통령 지지층에선 ""제대로 된 조사가 맞느냐""고 했고, 일부 비판하는 층에선 ""그마저도 안 나온다""고 꼬집었다.같은 대통령에 대한 지지율 평가인데, 왜 10%포인트(p) 가까이 차이가 나는 걸까. 이를 파악하기 위해 결과의 단순 수치가 아닌, 설문 조사를 설계한 과정까지 면밀히 들여다 볼 필요가 있단 지적이 나온다. '통계의 맹점'에 속지 않기 위해서다.우선 설문 조사에 들어가는 문항의 차이다. 특히 '잘 모르겠다'란 문항이 들어가느냐 마느냐에 따라서도 결과가 달라질 수 있다.여론조사 전문기관인 한국갤럽이나 리얼미터 등은 대통령의 국정운영 지지도 설문조사시 '잘 모르겠다'란 보기를 읽어주지 않는다. 대통령이 직무 수행을 잘하고 있다고 보는지, 그렇지 않은지, '긍정'과 '부정' 두 가지로 묻는다. 1차 질문에서 답하지 않으면 2차 질문서 재차 묻고, 그래도 모른다고 해야 '모름'으로 처리된다. ""모르겠다""를 두 번 말해야 하는 것이다.반면 내일신문과 서강대 현대정치연구소 여론조사에선 '잘하고 있다', '잘못하고 있다', '잘 모르겠다'는 3가지 지문을 제시했다. 아예 질문을 받을 당시부터 '잘 모르겠다'는 응답을 선택할 수 있는 것이다.결과가 어떻게 다를까. '잘 모르겠다'란 문항이 들어갈 경우, 이에 해당하는 비율이 높아지고 긍정·부정평가 비율이 동시에 떨어지게 된다. 실제 리얼미터 10월 2주차 대통령 국정운영지지도 조사 결과 '모름·무응답'은 2.5%에 불과했던 반면, 내일신문 여론조사에선 해당 비중이 18.3%에 달했다.왜 이럴까. 서복경 서강대 현대정치연구소 책임연구원은 ""한국갤럽처럼 정기적으로 조사하는 곳은 트렌드 변화를 살피는 게 목적이기 때문에, 가능한 지지와 반대 의견을 최대치로 조사해야 하는 것""이라며 ""반면 저희는 굳이 양자 택일을 강요하지 않고 선택지를 줘서 자유롭게 응답하도록 한다""고 했다.이럴 경우 유보층의 성격 파악을 할 수 있는 장점이 있다고도 밝혔다. 서 책임연구원은 ""상당수 유권자들이 잘함과 못함이 아닌 회색에 있는데, 어떤 분들이 왜 유보를 하는지 현재 갈등 지형의 성격을 보여주는 지표가 된다""며 ""상황이 앞으로 어떻게 바뀔 것인가에 대한 예측력도 볼 수 있는 것""이라고 설명했다.또 하나는 대통령에 대한 지지인지, 현 정부에 대한 지지인지에 대한 차이다.내일신문과 서강대 현대정치연구소는 '문재인 정부'의 국정 운영에 대한 것을 묻고 있는 반면, 리얼미터나 한국갤럽 등은 '문재인 대통령'의 국정수행 지지도를 묻고 있다.서 책임연구원은 ""통상 선거 예측력을 볼 때 정부의 퍼포먼스가 더 적합한 경우가 많아 서강대 현대정치연구소에선 이걸 묻고 있다""며 ""정부라는 건 검찰이나 기획재정부, 고용노동부 등 집합적 성과라서 대통령 개인 지지도보다는 낮게 나온다""고 설명했다. 이어 ""대통령이 마음에 들거나 진정성을 믿어도, 정부는 능력이 없다고 생각할 수 있기 때문""이라고 덧붙였다.그밖에도 설문조사에 영향을 미치는 변수는 많다.대표적인 게 설문 방식이다. 유선으로 묻느냐, 무선으로 묻느냐에 따라서도 결과가 갈린다. 보통 유선 조사는 노년층 등 경제 활동을 하지 않는 이들이 참여할 확률이 높고, 무선 조사는 경제 활동을 하는 2030세대와 중년층 등이 응답할 확률이 높다.또 '녹음된 음성'으로 질문하는 ARS 방식의 경우 정치에 관심이 적은 이들이 답변을 거부할 확률이 높은 것으로 해석된다. 정치에 관심이 더 많은 이들의 의견이 반영될 확률이 높은 것이다. 이와 다르게 상담원이 전화를 직접 걸어 설문조사를 진행하는 면접 방식도 있다.여론조사 전문가들은 조사결과를 수치 자체에 초점을 맞추고 의미 부여를 하기 보단, 흐름을 파악하는 수준으로 감안해야 한다고 조언했다.중앙선거여론조사심의위원회 관계자는 ""선거 여론조사라는 게 정답이 없고 그날 이슈와 날씨, 요일 등 모든 조건이 영향을 미칠 수 있다""며 ""비오는 날엔 집에 많이들 있으니 전화가 잘 되는 경우도 있고, 작은 변화에 따라 조사 결과가 달라지는 것""이라고 했다.이 관계자는 ""너무 숫자에 연연하기 보단 방향과 흐름으로 보는 게 설문 조사 목적에 맞지 않겠느냐""며 ""넓은 범위에서 해석하기 위해 참조하는 정보라는 것""이라고 조언했다.남형도 기자 human@mt.co.kr","2019,10,11",https://news.naver.com/main/ranking/read.nhn?mid=etc&sid1=111&rankingType=popular_day&oid=008&aid=0004290523&date=20191011&type=1&rankingSeq=10&rankingSectionId=100,15,0,1,695,5,48,머니투데이
naver_news,총 45억 소득 탈루한 유튜버 7명은 누구?,"더불어민주당 김정우 의원이 지난 2일 세종시 정부세종청사 기획재정부에서 열린 국회 기획재정위원회 국정감사에서 홍남기 경제부총리에게 질의하고 있다. 연합뉴스국세청이 지난 1년여간 탈세 혐의가 짙은 유튜버에 대한 세무조사를 실시해 유튜버 7명이 총 45억원의 소득을 탈루한 사실을 적발한 것으로 확인됐다.국회 기획재정위원회 소속 더불어민주당 김정우 의원이 10일 국세청에서 받은 자료에 따르면, 국세청은 작년부터 올해 9월까지 탈세 혐의가 짙은 유튜버에 대한 세무조사를 벌여 유튜버 7명이 총 45억원의 소득을 올려놓고도 광고수입금액 전액 누락 등으로 소득을 탈루한 사실을 적발했다.과세 당국에 적발된 일부 유튜버들의 사례이긴 하지만, 고소득 유튜버의 소득과 탈세 규모가 공개된 것은 이번이 처음이다.국세청은 지난해 1명, 올해 6명 등 총 7명의 고소득 유튜버의 탈세를 적발해, 이들에게 총 10억 원의 세금을 부과한 것으로 파악됐다.구글코리아에 따르면 한국인이 만든 유튜브 채널 중 구독자가 10만명 이상인 곳은 2015년 367개, 2016년 674개, 2017년 1275개 등으로 해마다 빠르게 늘고 있다.이처럼 유튜버 등 인플루언서들이 광고, 후원, 상품판매 등으로 상당한 고소득을 올리는 경우가 적지 않지만, 과세당국은 '신종 사업자'라 할 수 있는 유튜버들의 정확한 소득 규모를 파악하는 데 어려움을 겪고 있다.국내 유튜버 과세는 크게 두 가지로 나뉘는데, MCN(다중채널 네트워크·유튜버 등에게 방송기획·제작·송출, 프로모션 등을 지원하고 수익을 배분하는 기업) 소속 유튜버는 원천징수하기 때문에 소득 파악이 상대적으로 쉽지만, 대다수에 해당하는 개인 유튜버는 종합소득을 자진신고 하지 않으면 과세 당국이 수익을 파악하기 어려운 구조다.현재로선 유튜버의 국외 지급 소득과 관련해 한 사람당 연간 1만 달러 초과 외환 수취 자료를 한국은행에서 수집해 신고 안내, 세무조사 등에 활용하는 게 사실상 유일한 방편이다. 유튜버의 광고 수입이 싱가포르에 소재한 구글 아시아지사에서 외환으로 송금되기 때문이다.하지만 현재 외국환거래법과 거래 규정상 해외에서 국내로 송금되는 금액이 연간 1만 달러 초과일 때만 파악이 가능하기 때문에, 유튜버가 소득을 제3자 명의로 분산시키는 편법을 쓴다면 탈세를 막을 수 없는 허점이 있다는 지적이 나온다.국세청은 유튜버 등 신종사업에 대한 업종코드를 신설해 지난달부터 적용하고 있다고 밝혔다.이에 따라 유튜버 등 1인 방송인에 대한 소득 및 과세 규모는 내년 5월 종합소득세 신고 이후 파악이 가능할 것으로 보인다고 국세청이 김 의원실에 설명했다.김 의원은 ""국세청이 업종코드를 신설해 과세규모를 파악한다 해도 결제 한도 우회 등 과세망을 빠져나갈 구멍이 많은 상황""이라며 ""성실하게 세금을 납부하는 1인 방송인과의 형평성을 위해서라도 신종 과세사각지대에 대한 세원 관리 방안을 강화해야 한다""고 말했다.한편 네이버가 창작자와 창작자의 콘텐츠를 검색창 상단에서 확인할 수 있는 '인플루언서 검색' 서비스 출시 계획을 발표하면서 창작자들에게 적극적인 수익 배분을 약속했다. 구체적인 수익 배분 방식과 수치는 공개하지 않았지만 어떤 플랫폼보다 높은 비율로 창작자들과 창출된 수익을 나누기로 한 것이다.콘텐츠 시장에 대세로 떠오른 1인 창작자들은 주로 유튜브, 인스타그램 등을 근거지로 활용하고 있다. 공격적인 창작자 보상시스템은 유튜브를 세계적인 동영상 플랫폼으로 성장시킨 배경 중의 하나로 꼽힌다. 이에 따라 네이버는 창작자에게 검색창 '상석'을 내준 것은 물론 유튜브의 적극적인 보상책을 차용해 맞대응에 나섰다는 분석이 나온다.김현주 기자 hjk@segye.comⓒ 세상을 보는 눈,","2019,10,11",https://news.naver.com/main/ranking/read.nhn?mid=etc&sid1=111&rankingType=popular_day&oid=022&aid=0003404644&date=20191011&type=1&rankingSeq=1&rankingSectionId=101,11,3,2,348,15,47,세계일보
naver_news,"[속보] 홍남기 ""소재·부품 핵심전략품목 공급망 안정성 확보""","홍남기 부총리 겸 기획재정부 장관은 11일 ""소재·부품·장비 핵심전략품목의 공급망 안정성을 확보하기 위해 100+α에 해당하는 품목과 품목별 우선순위를 결정해 맞춤형 전략을 마련하겠다""고 강조했다.홍 부총리는 이날 대한상공회의소에서 열린 '제1차 소재·부품·장비 경쟁력위원회' 모두발언에서 이같이 말했다.그는 ""그동안 정부가 발표한 대책들을 보다 체계적으로 추진하기 위해 3대 전략을 구축할 필요가 있다""며 ""소재·부품·장비 산업 경쟁력 강화를 위한 특별회계를 신설해 매년 2조원 이상 재정을 투자하겠다""고 밝혔다.그러면서 ""가치사슬(VC) 구축을 위해 경쟁력위원회 산하 실무추진단과 대·중·소 상생협의회 등을 통해 기업간 협력모델을 발굴하고 맞춤형 패키지 형태의 지원을 하겠다""고 했다.홍 부총리는 ""3가지 핵심전략을 뒷받침할 수 있는 추진체계를 마련하기 위해 주요 대책의 법적근거가 되는 특별법이 연내 개정되도록 추진하겠다""고 언급했다.한경닷컴 뉴스룸 open@hankyung.comⓒ 한국경제 & hankyung.com , 무단전재 및 재배포 금지","2019,10,11",https://news.naver.com/main/ranking/read.nhn?mid=etc&sid1=111&rankingType=popular_day&oid=015&aid=0004221983&date=20191011&type=1&rankingSeq=2&rankingSectionId=101,9,0,1,72,0,1,한국경제
naver_news,(속보)홍남기 “100+알파 핵심전략품목 공급망 확보”,"홍남기 부총리 겸 기획재정부 장관. 홍남기 부총리 겸 기획재정부 장관.[서울경제] 홍남기 경제부총리 겸 기획재정부 장관은 11일 “소재·부품·장비 경쟁력 강화를 위해 100개 이상 핵심전략품목의 공급성 안정성 확보를 위하여 품목별 우선순위 결정, 맞춤형 전략을 마련하고 테스트 베드를 구축하겠다”고 밝혔다.이날 홍 부총리는 서울 대한상의에서 개최된 제1차 소재·부품·장비 경쟁력위원회 첫 번째 회의의 모두발언에서 이 같은 내용의 ‘소재·부품·장비 산업 경쟁력 강화 중점 추진전략’을 밝혔다. 홍 부총리는 “경쟁력위원회 산하 실무추진단과 대중소 상생협의회 등을 통해 기업 간 협력모델을 발굴하겠다”며 “아울러 특별 재정시스템 구축을 통한 안정적 재정지원을 위해 ‘소재부품장비 경쟁력 강화 특별회계’를 신설해 매년 2조원 이상 과감하게 재정을 투자할 것”이라고 강조했다. 소재·부품·장비 경쟁력위원회의 법적 근거인 ‘소부장 특별법’의 개정은 올해 안에 추진한다.경쟁력위원회 산하 실무추진단은 대중소 상생협의회 등을 열어 기업 간 협력 모델을 수시로 발굴하고, 경쟁력위원회의 승인을 통해 예산과 정책자금, 규제특례 등이 맞춤식 ‘패키지’로 기업을 지원할 예정이다./조양준기자 mryesandno@sedaily.com저작권자 ⓒ 서울경제, 무단 전재 및 재배포 금지","2019,10,11",https://news.naver.com/main/ranking/read.nhn?mid=etc&sid1=111&rankingType=popular_day&oid=011&aid=0003632544&date=20191011&type=1&rankingSeq=3&rankingSectionId=101,14,0,0,101,0,8,서울경제
naver_news,[집코노미TV] 강남 집주인 전화 안 받는 이유,"안녕하세요 집코노미TV입니다. 오늘은 말도 탈도 많았던 민간택지 분양가 상한제 이후 부동산 시장에 대해서 얘기해보겠습니다. 강영훈 네이버 붇옹산의 부동산스터디 카페 대표 모시고 얘기 나눠보겠습니다. 대표님, 이달 초에 나온 분양가 상한제 관련 방침을 보면 동별로 지정하겠다는 말이 있어요.정부가 원하는 건 분양가 상한제를 적용해서 분양가를 규제하려는 것이라기보다는 ‘주택도시보증공사(HUG)와 협의를 해서 저렴하게 빨리빨리 가라’는 것이죠. 후분양보다 오히려 선분양을 권장하는 것이죠. 왜냐면 선분양으로 분양받은 분들은 이미 주택을 구입한 것이기 때문에 재고주택 시장으로 뭔가를 더 사려고 나오진 않을 거 아니에요. 지금 시점에선 수요를 잡기 위해서 그렇게 의도하는 게 아니냐고 보이는 것이죠.후분양으로 못 도망가게 하고 HUG의 분양가 규제(고분양가 관리)를 받으라는 거죠?그렇죠. ‘어차피 후분양으로 가봐야 분양가 상한제로 틀어막을 테니 HUG랑 해결하고 오세요’라는 거죠. 빠져나오는 단지만 치겠죠. 그런데 그렇게 분양가를 누를 때 억울한 단지들이 나오겠죠. 예를 들어 신반포15차 같은 경우 아예 후분양을 계획하고 시공사를 정했는데 이 때문에 반포동을 상한제 대상 지역으로 걸면 선분양을 하려다 같이 규제를 받는 단지도 나오겠죠.지금 강남권 중개업소 사장님들이 말씀하시는 게 매물이 없다는 얘기입니다. 안 그래도 매물이 없었는데 이 추가 수요들이 시장을 흔들기 시작하면 가격이 더 오르는 거죠. 버블은 급격하게 커지는 것입니다. 그런 상황이 정부 입장에선 공포스러웠을 겁니다. 그래서 다소 무리하다고 평가될 수 있는 상한제가 나온 거죠.그렇다면 상한제를 못 피한 곳들의 일반분양가는 확실하게 잡힐까요? 얼마나 떨어질까요?이미… 자, 보세요. 삼성동 상아2차를 재건축한 ‘래미안라클래시’의 경우 청약 경쟁률이 115대1 나왔죠. 청약가점 커트라인이 64점, 평균가점이 69점에 이른다는 집코노미 기사도 나왔죠. 부양가족 4명이어야 하고, 무주택기간과 청약통장 가입기간은 만점이어야 하는 조건이죠. 자녀도 몇 명 없으면 강남에 아파트 받을 생각 말라는 내용이던데요. 그런 청약경쟁률이나 가점이 분양가 상한제 하에서 나왔나요?그 전이죠.네, 지금 상한제가 시행되지 않았는데도 이미 시장은 이렇습니다. 분양가가 매력적이니까요. 상아2차의 분양가가 공개되자마자 부동산 커뮤니티에선 당첨만 되면 10억이란 얘기가 나왔어요. 이 옆에 입주한 지 11년 된 아파트가 20억원을 넘는데 신축 아파트 같은 면적대가 이보다 저렴하니까요.한남뉴타운처럼 강북에서 가장 뜨거운 지역들도 상한제 대상이 될 것 같은데 조합원 입장에선 어떤 상황일까요?제가 볼 땐 별로 고민들 안 하실 것 같아요. 먼 얘기입니다. 분양가 상한제에 따라서 ‘우리 언제 분양하느냐’는 너무 먼 얘기예요. 아직 시공사도 결정되지 않았고요. 성수전략정비구역 2지구는 올 연말 조합 설립하려고 하죠. 초·중기 사업장들은 ‘상한제가 언제까지 있겠어?’ 이런 분위기죠. 아직까지 눈 앞에 닥친 문제가 아니기 때문에 ‘나중에 생각하자’고 해서 그렇게 크게 동요하지 않는 모습인 것 같아요.기간은 어느 정도일까요?한남뉴타운에서 가장 속도 빠른 곳이 3구역인데 올해 시공사를 선정하면 내년 조합원 분양신청을 하죠. 그런데 시공사를 선정할 때 대안설계니 뭐니 해서 설계변경에 들어가겠죠. 그런데 그것도 한참 걸리죠. 서울시에 서류가 올라갔다 내려오는데 시간이 걸리고, 관리처분계획 변경하고, 이주하고… 이러다 보면 분양이 몇 년 뒤에 될지 몰라요. 그렇다면 그때 가서 고민할 이슈이기도 하고요. 한남3구역도 일반분양분의 비율이 그렇게 많은 편은 아니에요. 조합원수 대비 일반분양 비율이 높지 않은 곳들은 상대적으로 분양수입 감소분이 그렇게 크지 않습니다. 어차피 조합원들이 추가분담금을 많이 내가면서 사업하는 곳들이기 때문에 조금 더 낸다는 느낌이죠. 그러나 사업성이 굉장히 좋았던, 조합원수 대비 일반분양분이 많았던 곳들은 분양수입이 줄면 조합원들이 낼 돈도 늘어나죠. 사업성에 대한 리스크가 늘어나는 거죠.그렇다면 지금 가격보다 더 뛸 가능성이 있다?강남 재건축이 지금 그렇게 막 움직이는 건 아닌데. 예를 들면 잠실주공5단지나 대치 은마의 경우 전고점을 향해, 전고점을 넘어가고 있잖아요. 이들 단지는 왜 그럴까요? 시장의 판단은 그런 거예요. 주변의 신축 가격이 신고가를 경신하면서 가격을 벌리니까 상한제에 따른 추가분담금이 부담돼도 신축이 되면 현재 가격이 오른 신축보다 가격이 높아질 테니 당장은 분담금을 내도 향후 상승분에 대한 요인이 더 생기니까 가격이 그렇게 가는 겁니다. 그런 영향이 당연히 재개발에도 있고요.서울의 부동산은 형님이 잘 가면 동생들이 따라가는 경향이 있습니다. 예컨대 강남의 대장과 서초의 대장이 서로 가격을 견주면서 움직이는 부분이 있는 것처럼 재개발 중에서도 대장 가격들이 서로 견주면서 왔다갔다 맞추는 키맞추기 경향이 있거든요. 한남뉴타운은 강 건너에 있는 반포 재건축에 시차를 두면서 가격을 맞춰가는 경향이 있어요. 그 동네 중개업소에 가면 사장님들이 그렇게 브리핑합니다. ‘반포가 25억원인데 80%는 가지 않겠느냐’고요. 15년 전에도 그랬는데 지금도 그래요. 중요한 건 그 말이 맞다 틀리다가 아니에요. 수요자들은 그 내용에 반응하면서 가격 움직임이 있어 왔고 지금도 그 영향을 받는다는 거죠.정부가 강남 부동산 가격을 잡으려는 게 이해 돼요. 강남 부동산만 잡으면 사실 국내 부동산 가격은 다 잡을 수 있습니다. 강남을 넘어서는 다른 지역은 나올 수 없거든요. 강남 아파트가 3.3㎡당 5000만원대로 고꾸라지면 용… (머뭇머뭇) 아니, 서초가… 아니, 송파가, 강동이 넘어설 수 있을까요? 시장을 그렇게 제어한다는 게 사실 어려운 거죠.결국 이번 대책 때문에 집값이 떨어지긴 어렵겠네요? 근본적인 수급 문제가 해결되진 않았으니까요.(깊은 한숨) 사실 저는 불안해요. 더 올라가면 상대적 박탈감을 느끼는 사람이 엄청나게 더 늘어날 거 아니에요. 안정화됐으면 좋겠는데 정책으로 부작용이 심하게 나타나면서 가격이 오른다고 하면 저는 싫을 것 같아요. 걱정입니다. 안 그랬으면 좋겠어요.안 그랬으면 좋겠지만 오를 것 같다?아뇨아뇨, 안 그랬으면 좋겠다.알겠습니다. 강 대표님이 분양가 상한제에 대해서 많이 얘기해주셨습니다. 지금까지 집코노미TV였습니다.집코노미TV조성근 건설부동산부장구민기 기자김예린 인턴PD이지현 인턴PD한국경제신문·한경닷컴ⓒ 한국경제 & hankyung.com , 무단전재 및 재배포 금지","2019,10,11",https://news.naver.com/main/ranking/read.nhn?mid=etc&sid1=111&rankingType=popular_day&oid=015&aid=0004221953&date=20191011&type=1&rankingSeq=4&rankingSectionId=101,9,0,0,5,1,2,한국경제
naver_news,오늘부터 철도 파업…광역전철·KTX 운행 줄어,"동영상 뉴스[앵커]오늘 아침부터 전국철도노동조합이 파업에 들어갑니다.광역철도와 KTX 운행이 평소보다 대폭 줄어들어 시민들의 불편이 예상됩니다.나경렬 기자입니다.[기자]2016년 9월 이후 3년 만에 파업에 나선 철도노조.파업기간은 오늘(11일) 오전 9시부터 다음주 월요일인 14일 오전 9시까지입니다.철도노조 파업으로 여객과 화물 열차의 운행이 평소보다 20∼60% 줄어들게 돼 이용객들이 불편을 겪을 것으로 보입니다.파업기간 운행이 중단되는 열차 표를 구매한 승객은 9만5,800명으로, 아직도 2만~3만명이 승차권 예매를 변경하거나 취소하지 않았습니다.앞서 코레일은 파업을 예상하고 지난 4일부터 파업기간 운행이 중지되는 열차의 승차권을 팔지 않았습니다. ""파업기간 중 일부 열차의 운행이 중지되는 만큼 승차권을 미리 구매한 고객께서는 운행 중지 여부를 확인한 후 다른 열차로 변경해 주시기 바랍니다""파업 기간 광역전철 운행은 평시 대비 88.1% 수준을 유지하고, KTX는 평시 대비 72.4% 수준으로 운행될 것으로 보입니다.새마을호와 무궁화호 등 일반열차는 60% 선만 운행하고, 화물열차는 대체기관사 350여명을 투입해 수출입과 산업필수품 등 긴급 화물 위주로 수송할 계획입니다.코레일은 오늘 저녁 퇴근길이 가장 혼잡할 것으로 내다봤습니다.월요일인 14일 출근길 열차는 대체 인력을 대거 투입해 정상 운행할 계획입니다.연합뉴스TV 나경렬입니다. (intense@yna.co.kr)연합뉴스TV 기사문의 및 제보 : 카톡/라인 jebo23","2019,10,11",https://news.naver.com/main/ranking/read.nhn?mid=etc&sid1=111&rankingType=popular_day&oid=422&aid=0000396167&date=20191011&type=2&rankingSeq=5&rankingSectionId=101,1,0,0,83,0,5,연합뉴스TV
