source,title,article_body,collect_time,link,good,nice,sad,angry,wanted,recommand,press
naver_news,'왜 무시해' 여친 흉기 위협 만취 20대 입건,"【광주=뉴시스】광주 서부경찰서 전경. 2019.10.11. (사진=뉴시스 DB) photo@newsis.com 【광주=뉴시스】광주 서부경찰서 전경. 2019.10.11. (사진=뉴시스 DB) photo@newsis.com【광주=뉴시스】변재훈 기자 = 광주 서부경찰서는 11일 여자친구를 흉기로 위협하고 가전제품 등을 부순 혐의(특수협박 등)로 A(26)씨를 입건해 조사 중이다.A씨는 이날 오전 1시40분께 광주 서구 한 빌라 내 가정집에서 여자친구 B(25)씨를 흉기로 위협하고 선풍기와 상을 집어 던져 부순 혐의다.조사 결과 A씨는 B씨를 비롯한 일행 3명과 함께 술을 마시고 있었으며, 'B씨가 무시하는 말을 했다'며 격분해 이 같은 일을 벌인 것으로 드러났다.A씨는 술·안주가 놓인 상, 선풍기를 던진 뒤 부엌에서 흉기를 들고 와 '가만두지 않겠다'며 B씨를 위협한 것으로 조사됐다.A씨가 흉기를 든 채 다가오자 B씨는 급히 화장실로 피했으며, A씨는 스스로 경찰에 신고한 것으로 전해졌다.B씨의 피해 진술을 확보한 경찰은 A씨를 현행범으로 체포했다.경찰은 A씨 등을 상대로 정확한 경위를 조사할 방침이다.wisdom21@newsis.com","2019,10,11",https://news.naver.com/main/read.nhn?mode=LSD&mid=shm&sid1=102&oid=003&aid=0009499458,0,0,0,0,1,0,뉴시스
naver_news,통근버스가 좌회전하던 택시 들이받아…12명 부상,"[앵커]어제저녁 부산에서 통근버스가 택시를 들이받는 사고가 나 12명이 다쳤습니다.곳곳에서 화재도 잇따랐습니다.사건 사고 소식, 김민지 기자입니다.[리포트]하천에 버스 한 대가 빠져 있습니다.어젯밤 9시 20분쯤 부산 강서구에서 직진하던 통근버스가 반대편에서 좌회전하던 택시를 들이받았습니다.이 사고로 택시 운전자 이 모 씨가 크게 다쳤고, 버스에 타고 있던 11명도 병원으로 이송됐습니다.버스는 사고 직후 인근 하천으로 빠졌지만, 승객들은 모두 무사히 빠져나왔습니다.노란색 버스에서 연기가 뿜어져 나옵니다.어젯밤 11시 40분쯤 서울 동대문구 장안동의 한 유치원에 주차된 유치원 버스에서 불이 나 40여분 만에 꺼졌습니다.이 불로 인명피해는 없었지만, 유치원 버스 3대가 불에 타 소방서 추산 800만 원의 재산피해가 났습니다.소방당국은 버스 운전석 아래쪽에서 불이 시작된 것으로 보고 정확한 화재 원인을 조사하고 있습니다.비슷한 시각, 경남 창원시의 한 공장 사무용 컨테이너에서도 불이 났습니다.불은 40분 만에 꺼졌지만 소방서 추산 5백만 원의 재산 피해가 발생했습니다.경찰과 소방당국은 폭발음과 함께 불이 시작됐다는 목격자의 진술을 토대로 정확한 화재 원인을 조사하고 있습니다.앞서 어제저녁 7시 10분쯤엔 서울 성동구 행당동의 한 지하 1층 노래방에서 불이 났습니다.다친 사람은 없었지만 노래방 집기류 등이 불에 타 소방서 추산 약 3백만 원의 재산피해가 났습니다.소방당국은 노래방 주방에서 불이 난 것으로 보고 있습니다.KBS 뉴스 김민지입니다.김민지 기자 (ming@kbs.co.kr)","2019,10,11",https://news.naver.com/main/read.nhn?mode=LSD&mid=shm&sid1=102&oid=056&aid=0010751983,0,0,0,0,0,0,KBS
naver_news,불편한 다리로 담 넘어 범행?…석연찮은 8차 수사기록들,"동영상 뉴스[앵커]들으신대로 경찰은 과거 수사에 문제가 있었는지 퇴직한 당시 경찰관들을 찾아가서 조사하고 있습니다. 이 8차 사건에 대한 판결문을 봐도 의문이 드는 부분들이 있습니다.이어서 김지성 기자입니다.[기자]1989년 선고된 화성 8차 살인사건의 1심 판결문입니다.윤씨가 소아마비를 앓아 왼쪽 다리가 불편하다는 내용이 나옵니다.""신체적 불구""라는 표현도 있습니다.윤씨의 교도소 지인들의 기억도 비슷합니다.[이중건/과거 수감 동료 : (제가 장애 3급인데) 다리를 저보다 더 절었어요.]그런데 같은 판결문에 윤씨가 ""피해자 집 뒷담을 넘어 마당으로 침입했다"", 또 ""방문 앞을 가로막은 책상을 밟고 넘어갔다""고 기록돼 있습니다.윤씨는 언론 인터뷰에서 당시 경찰이 쪼그려뛰기를 시켰고, 못하고 넘어지자 구타가 이어졌다고 말했습니다.자백한 시간을 두고도 당시 기록과 윤씨 주장이 엇갈립니다.2심 판결문에는 '조사 시작 4시간 40분 만에 윤씨가 범행을 자백했다'고 나옵니다.하지만 윤씨는 언론 인터뷰에서 경찰이 사흘 동안 잠을 안 재우고 조사했다고 말했습니다.경찰이 불러준 대로 진술서를 쓰고 자백했다고도 했습니다.경찰은 당시 수사관계자들을 참고인 신분으로 조사하고 있습니다.(영상디자인 : 배장근)김지성 기자 (kim.jiseong@jtbc.co.kr) [영상편집: 박수민]Copyright by JTBC(http://jtbc.joins.com) and JTBC Content Hub Co., Ltd. All Rights Reserved. 무단 전재 및 재배포 금지","2019,10,11",https://news.naver.com/main/read.nhn?mode=LSD&mid=shm&sid1=102&oid=437&aid=0000221643,0,0,0,0,0,0,JTBC
naver_news,"이승환, '동안계 지존' 손석희에 ""예전보다 상하셨다""","가수 이승환(왼쪽)과 손석희 JTBC ‘뉴스룸’ 앵커 (사진=‘뉴스룸’ 트위터)[이데일리 박지혜 기자] 연예계 ‘최강 동안’으로 꼽히는 가수 이승환(53)이 언론계 대표 동안인 손석희(63) JTBC ‘뉴스룸’ 앵커를 만나 “예전보다 상하셨다”라고 말했다.올해로 데뷔 30주년을 맞이한 이승환은 지난 10일 오후 ‘뉴스룸’ 문화초대석에 출연해 손 앵커에게 이같은 말을 건넸다.그러자 손 앵커는 “상했다는 게 늙었다는 얘기잖나”라고 했고, 이승환은 “워낙 젊으셨으니까. 동안계의 거의 지존이시고”라고 답했다.이어 4년 전 두 사람의 모습을 함께 본 뒤 이승환은 “저는 뭐 별다른 게 없어보인다”라며 자신감을 보였다. 이에 손 앵커는 “안 변했다. 저만 상했다”라고 반응했다.이승환은 또 손 앵커에게 “속상하신가”라며 “저는 그렇게 생각한다. 믿음, 소망, 사랑 중에 제일은 ‘동안’”이라고 덧붙였다.10시간 가까운 공연에도 쌩쌩한 모습을 유지하는 비결에 대해 이승환은 “규칙적이고 절제된 생활을 한다”라고 밝히기도 했다.인터뷰 중 손 앵커는 이승환의 정치적 발언이나 활동을 의식한듯 “사실 오늘 (이승환을) 모시기 전에 약간의 고민이 있었다”라고 말했다. 이승환도 “그 고민 제가 감히 짐작이 간다”라고 답했다.손 앵커는 “짐작하시는 그 고민, 다시 말하면 요즘 워낙 시국이 좀 그러니까 (제작진은) 이 자리가 좀 어떨까 모르겠다고 했는데 제가 그렇게 생각하지 않는다고 했다”라고 밝혔다.이승환의 밝고 적극적인 모습에 손 앵커는 “오늘 분위기가 굉장히 좋다”라고 했고, 이승환은 “제가 앨범 홍보를 할 수 있는 자리가, TV 출연은 섭외가 딱 여기밖에 없어서”라고 말했다.이승환은 오는 15일 데뷔일에 맞춰 12집 정규 앨범 ‘‘FALL TO FLY 後’을 공식 발표한다.박지혜 (noname@edaily.co.kr)네이버 홈에서 ‘이데일리’ 뉴스 [구독하기▶] 꿀잼가득 [영상보기▶] , 청춘뉘우스~ [스냅타임▶]＜ⓒ종합 경제정보 미디어 이데일리 - 무단전재 & 재배포 금지＞","2019,10,11",https://news.naver.com/main/read.nhn?mode=LSD&mid=shm&sid1=103&oid=018&aid=0004487961,0,0,0,7,0,0,이데일리
naver_news,"한국GM 노사, 접점 찾지 못해 교섭 중단…임금 협상 장기화","한국GM 노동조합이 9월 24일 부평공장 본관 앞에서 2019 단체교섭 노조 요구 수용 촉구와 카허 카젬 사장 퇴진을 요구하는 기자회견을 진행하고 있다.(사진=이소현 기자)인천시 부평 한국 GM 공장. (사진=연합뉴스)한국GM 부평공장 정문에 카허 카젬 한국GM 사장 퇴진을 주장하는 현수막이 걸려있다.(사진=이소현 기자)[이데일리 이소현 기자] 한국GM 노동조합이 올해 임금협상 10차 단체교섭을 중단했다. 노조는 더는 사측과 교섭을 진행하지 않겠다고 밝혔다.11일 자동차업계에 따르면 한국GM 노사 10차 교섭은 지난 8일부터 정회와 속개를 반복되며 이날까지 마라톤협상을 이어갔지만, 평행선을 달리던 노사는 결국 접점을 찾지 못했다.이로써 지난 7월 9일 시작한 한국GM 노사의 임금협상 단체교섭은 부분 및 전면파업 등이 이뤄진 가운데 결국 빈손으로 끝나게 됐다. 노조는 11일 오전 중앙쟁의대책위원회를 열고 앞으로 투쟁지침 등을 정할 예정이다.한국GM 노조는 “장시간 정회와 많은 토론 속에 지부장이 교섭중단을 선언했다”며 “10차 교섭을 끝으로 단체교섭 중단을 선언한다”고 설명했다.노조는 이번 교섭에서 회사의 진정성에 대해 의구심을 가졌다. 특히 이번 교섭에서 기대했던 미래 발전 방안에 대해 만족할 만한 답변을 내놓지 않아 회사가 충분한 준비 없이 교섭에 나왔다며 크게 반발했다.노조는 “교섭이 막바지인데 (회사는) 진정성이 없다”며 “노동조합에서 일하겠다고 (생산할) 차를 달라고 하는데 그걸 노동자가 구걸해야 하는가 이게 노사 상생인가”라고 지적했다. 이에 한국GM은 “회사를 진정성 있게 봐달라”며 “함께 미래를 만들어가자. 노력하고 있다”고 전했다.앞서 한국GM은 지난 8일 교섭에서 “지난해 맺은 임금합의에 대한 원칙을 지켜나가야 하는 것을 중요하게 생각한다”며 “올해 임금 교섭에서 수익성 명분이라는 틀 안에서 이뤄져야 한다”고 강조했다.한국GM 노사는 지난해 단체협상에서 임금 인상과 성과급은 회사의 수익성 회복에 따라 결정되며, 전년도 소비자물가 상승분을 웃돌지 않는다고 약속한 바 있다. 이에 사측은 노조가 요구한 기본급 인상과 성과급 지급은 어렵다는 견해를 고수한 것이다.그러면서 한국GM은 노조 조합원들에게 한국GM의 신차를 구매할 때 차종별로 1인당 100만∼300만원 규모 추가 할인 혜택을 제공하는 특별 협상안을 제시했다. 임금 인상 대신 복지 확대를 제시한 것이다.노조는 “협상안은 도저히 수용하기 어려운 수준”이라며 크게 반발했다. 앞서 한국GM 노조는 기본급 5.65% 정액 인상, 통상임금의 250% 규모 성과급 지급, 사기진작 격려금 650만원 지급 등의 내용을 담은 임금협상 단체교섭 요구안을 제시했다.노조는 사측이 제시한 바우처 제공 등 복지확대와 관련해 “비정규직(사내도급업체 지원) 등 조합원에게 전체적으로 돌아가지 않은 바우처에 대해 반대한다”며 “차량별 차등 지급에 대한 문제도 있다”고 지적했다. 또 팀장급 이상 직원들만 평균 1700만원가량 성과급과 1.8% 임금인상을 받은 ‘팀 GM’의 문제도 지적하며, 임원 경영진의 고통분담에 대해서도 약속을 요구했다.특히 인천 부평 2공장의 지속 가능한 발전 전망 계획, 부평 엔진공장 중장기 사업계획, 창원공장 엔진생산 등에 대한 확약 등을 재차 요구했다. 노조는 “정부 보조금을 받을 때는 10년을 바라보고 지원받으면서 조합원들의 3~4년 후의 전망에 대해서는 이야기하지 못하고 있다”고 질타했다.한국GM 노사 간의 갈등은 장기화할 것으로 우려된다. 한국GM 노조 현 집행부의 임기는 올해 말까다. 차기 집행부가 선출되면 내년부터 2019년도 임금협상을 진행해야 할 것으로 전망한다. 게다가 재개된 10차 교섭에서도 입장 차이를 줄이지 못하면서 노조가 추가 파업에 나설 가능성도 있다.이소현 (atoz@edaily.co.kr)네이버 홈에서 ‘이데일리’ 뉴스 [구독하기▶] 꿀잼가득 [영상보기▶] , 청춘뉘우스~ [스냅타임▶]＜ⓒ종합 경제정보 미디어 이데일리 - 무단전재 & 재배포 금지＞","2019,10,11",https://news.naver.com/main/read.nhn?mode=LSD&mid=shm&sid1=103&oid=018&aid=0004487945,0,0,0,2,0,0,이데일리
naver_news,"""도쿄 때린다"" 강력 태풍 하기비스, 日 본토 접근···""한반도에도 강풍""","/연합뉴스 /연합뉴스/연합뉴스 /연합뉴스[서울경제] 올해 발생한 태풍 가운데 가장 강력한 제19호 태풍 ‘하기비스(Hagibis)’가 이번 주말 일본을 강타할 것으로 예상되는 가운데 일본 본토 부근까지 북상했다.11일 기상청 예보에 따르면 이날 오전 3시 기준 태풍 하기비스는 일본 오키나와 동쪽 약 1,060km 부근 해상에서 시속 23km로 북동쪽 이동 중이다. 중심기압은 925hPa(헥토파스칼), 중심 부근에서는 초속 51m(시속 184km)의 최대 풍속을 보이고 있다.하기비스는 이날 오후 3시쯤에는 일본 오키나와 동북동쪽 약 940km 부근 해상에 접근할 것으로 보인다. 이어 토요일인 12일 오전 3시에는 일본 도쿄 남남서쪽 약 650km 부근 해상에, 13일 오전 3시에는 일본 도쿄 북동쪽 약 90km 부근까지 올라올 것으로 예상된다. 이어 14일 오전 3시에는 일본 삿포로 동쪽 약 780km 부근 해상에 접근할 전망이다.필리핀에서 제출한 이름으로 ‘빠름’을 의미하는 하기비스는 당초 한반도에 직접적인 영향을 주지 않을 것으로 예상됐지만 워낙 태풍 반경과 세력이 큰 상태여서 제주도와 남해안, 동해안을 중심으로 바람이 강하게 불어 주말에 강풍 특보가 내려질 것으로 보인다.이와 관련 기상청은 “강풍을 타고 온 너울성 파도가 해안가를 덮칠 가능성도 있다”면서 기상청은 “태풍의 영향에서 벗어나도 강풍이 불고 파도가 높게 일 것으로 보인다. 시설물 관리와 안전사고에 각별히 유의하길 바란다”고 주의를 당부했다. /김경훈기자 styxx@sedaily.com저작권자 ⓒ 서울경제, 무단 전재 및 재배포 금지","2019,10,11",https://news.naver.com/main/read.nhn?mode=LSD&mid=shm&sid1=103&oid=011&aid=0003632563,11,4,2,2,0,4,서울경제
naver_news,"일본 근처까지 온 슈퍼태풍 하기비스…""일요일엔 도쿄""","태풍 하기비스 경로/사진제공=기상청 태풍 하기비스 경로/사진제공=기상청[머니투데이 김도엽 인턴] ['하기비스'는 필리핀어로 '빠름' 뜻해…일요일에 도쿄 육상, 우리나라 제주·남해안·동해안은 강풍주의]제19호 태풍 '하기비스'가 일본 본토 부근까지 북상했다.기상청에 따르면 오늘(11일) 오전 3시 태풍 하기비스는 일본 오키나와 동쪽 약 1060km 부근 해상에서 시속 23km로 북동쪽 이동하고 있다. 중심기압은 925hPa(헥토파스칼), 중심 부근 최대 풍속은 초속 51m(시속 184km)에 달한다.하기비스는 오늘 15시 일본 오키나와 동북동쪽 약 940km 부근 해상에 접근할 예정이며 12일(토) 3시에는 일본 도쿄 남남서쪽 약 650km 부근 해상에, 13일(일) 3시에는 일본 도쿄 북동쪽 약 90km 부근 육상, 14일(월) 3시에 일본 삿포로 동쪽 약 780km 부근 해상에 접근할 예정이다.19호 태풍의 이름 하기비스는 필리핀에서 제출한 이름으로, '빠름'을 뜻한다. 당초 하기비스는 경로에서 벗어나 우리나라에 직접적인 영향을 주지 않을 것으로 예상됐지만, 그 위력으로 제주도와 남해안, 동해안을 중심으로 바람이 강하게 불어 주말에 강풍 특보가 내려질 것으로 보인다.기상청은 ""강풍을 타고 온 너울성 파도가 해안가를 덮칠 가능성도 있다""면서 기상청은 ""태풍의 영향에서 벗어나도 강풍이 불고 파도가 높게 일 것으로 보인다. 시설물 관리와 안전사고에 각별히 유의하길 바란다""고 당부했다.김도엽 인턴 dykfactionist@mt.co.kr","2019,10,11",https://news.naver.com/main/read.nhn?mode=LSD&mid=shm&sid1=103&oid=008&aid=0004290571,12,0,1,1,0,1,머니투데이
naver_news,[여행] 가을빛으로 물들어가는 '왕의 숲'을 거닐다,"국립수목원 숲길 중 가장 인기있는 전나무 숲길을 걷고 있는 탐방객국립수목원에 활짝 핀 구절초. 10월의 산야는 국화과 식물들 일색이다. 그중 유난히 흐트러짐이 없이 단아한 자태를 뽐내는 꽃이 이 바로 우리의 꽃 구절초다. 서양의 꽃이 야단스럽고 호화스럽다면 우리의 꽃은 순수와 향기로 대표되는데 그중에서도 손꼽을 수 있는 우리 여인과 같은 꽃이 ‘구절초’라고 할 수 있다.국립수목원에 활짝 핀 구절초. 10월의 산야는 국화과 식물들 일색이다. 그중 유난히 흐트러짐이 없이 단아한 자태를 뽐내는 꽃이 이 바로 우리의 꽃 구절초다. 서양의 꽃이 야단스럽고 호화스럽다면 우리의 꽃은 순수와 향기로 대표되는데 그중에서도 손꼽을 수 있는 우리 여인과 같은 꽃이 ‘구절초’라고 할 수 있다.국립수목원 수생식물원에서 한적한 오후를 보내고 있는 탐방객경기 포천 국립수목원 내 전나무 숲에서 휴식을 즐기고 있는 탐방객들세조와 정희왕후 윤씨의 능을 모신 광릉지난달부터 국립수목원에서 봉선사까지 걸을 수 있는 ‘광릉숲길’이 새로 생겼다.[이데일리 강경록 기자] 가을이 제 모습을 드러내기 시작했다. 가을 향은 어느 숲을 가더라도 짙고 그윽하다. 가까운 공원에도, 이웃한 마을에도 저마다 가을빛을 내뿜는 나무가 있고, 또 낙엽은 쌓인다. 가을 숲길이 아름답기로는 수목원과 휴양림이 첫째다. 자연 훼손을 최소화하면서 최대한 숲을 즐기며 쉬도록 가꿔놓았기 때문이다. 경기 포천에 자리한 광릉숲이 딱 그런 곳이다. 크고 작은 물길과 물길을 따라 이어진 산책로에는 어느덧 붉고 노란 가을 이파리들이 내려앉고 있다. 눈과 귀를 열고 오래 머물며 숨쉬기 좋다. 가을빛 가득한 국립수목원과 광릉, 봉선사로 이어지는 숲길을 따라 걸어보자.◇550여년 지켜온 보물 같은 ‘광릉숲’국내에서 가장 아름다운 숲으로 손꼽히는 ‘광릉숲’. 이 숲은 국립수목원(옛이름 광릉수목원)을 포함한 광릉(남양주시 진전읍) 주변의 천연림으로, 국내에서 가장 잘 보전된 온대림이다. 굴참나무·졸참나무·갈참나무 등 참나무류와 서어나무·오리나무·까치박달나무 등 활엽수들이 ‘극상림’(다양한 식생이 안정된 상태를 이룬 산림)을 이루고 있다. 1468년부터 나라에서 관리해온 덕이다. 희귀 생물이 많이 살고 있을 뿐 아니라 크낙새와 하늘다람쥐, 장수하늘소 등 천연기념물 20여종이 서식하고 있다.원래 이 숲은 무예에 능했던 조선 7대 왕 세조가 즐겨 찾던 사냥터가 있던 곳이었다. 1466년 세조가 세상을 뜨자, 그가 좋아했던 숲에 능을 조성하면서 ‘광릉숲’으로 불렸다. 이후 조선왕실은 광릉 주변 숲의 벌목을 금하는 등 엄격하게 관리했다. 일제강점기에는 학술보호림으로, 한국전쟁 이후에는 시험림으로 일반인의 출입을 막으면서 현재와 같은 숲을 이루게 됐다. 2010년 유네스코가 광릉숲을 생물권보전지역으로 지정한 것은 결코 우연이 아니다.광릉숲 전체가 일반인 출입을 완전히 금한 것은 아니다. 광릉은 언제나 출입할 수 있고, 국립수목원도 사전예약으로 신청한 한정 수의 관람객을 허용한다. 출입을 금한 광릉숲 일부를 1년에 딱 한 번 공개하기도 한다. 하지만 이 숲이 가지고 있는 매력을 충분히 느끼기에는 부족했던 것도 사실. 특히 차로 지나칠 수밖에 없는 국립수목원과 봉선사의 아름드리 전나무 길은 아쉬움의 대상이었다.그러던 중 지난 5월 국립수목원과 봉선사를 연결하는 3㎞ 구간의 ‘광릉숲길’을 개통했다. 기존 차도를 따라 조성한 이 길은 자연의 훼손을 최소화하기 위해 나무데크로 산책로를 만들어 사람들이 직접 숲으로 들어가지 못하게 했다. 길을 가로막고 있는 나뭇가지들은 불편하더라도 자연의 가치를 느낄 수 있도록 그대로 뒀다. 사람들의 시선을 제한하는 구멍 뚫린 나무벽 역시 개천에서 쉬고 있는 새들이 놀라지 않도록 배려한 것이다. 산책로에서 자연보호의 중요성을 알리는 팻말을 많이 볼 수 있는 것도 이러한 까닭이다. 방문객을 위한 시설도 있다. 새소리와 함께 피톤치드를 마시며 책을 볼 수 있는 숲속 도서관, 흐르는 물과 시원한 바람을 느낄 수 있는 쉼터들이 곳곳에 있어 자연을 만끽할 수 있다.◇피톤치드 가득한 왕의 숲으로 가다광릉숲의 일부는 국립수목원이다. 1987년 봄에 개원했다. 광릉숲 전체 면적 2420㏊에서 1119.5㏊가 일반인에게 개방하는 국립수목원이다. 자연을 배우고 즐기며 쉬고 싶어하는 이들을 위한, 국내 최고의 활력 재충전소라 할 만하다. 자연 그대로의 숲을 활용해 탐방로를 내고, 호수를 들이고, 습지를 조성하고, 최소한의 쉼터를 만들어 놓았다.국립수목원은 다양한 국가적 기능을 갖춘 연구기관이기도 하다. 국내·외 산림 관련 자료를 전시한 산림박물관과 산림생물표본관(연구시설)도 들어서 있다. 여기에 광장을 중심으로 관상수를 모아 놓은 ‘관상수원’, 한반도 모습을 본뜬 ‘수생식물원’, 시각장애인을 위해 냄새나 촉감으로 구분하기 쉬운 수목을 모아 놓은 ‘손으로 보는 식물원’ 등이 있다. 여기에 습지식물원·난대식물원(온실)·양치식물원·덩굴식물원·향료식물원 등 11개의 전문 전시원에서도 다양한 식물을 만날 수 있다. 수목원을 한 바퀴 둘러보는 데 두 시간가량 걸리지만, 숲과 나무·꽃의 자태를 감상하며 쉬엄쉬엄 걷다 보면 서너 시간이 금세 지나간다.수목원 정문에서 어린이정원을 거쳐 왼쪽으로 난 오솔길을 지나면 숲생태관찰로와 아름다운 육림호로 이어진다. 숲생태관찰로는 울창한 자연림 사이로 만든 매혹적인 길이다. 두 사람이 나란히 걸을 만한 데크가 구불구불하다. 숲 향기에 젖은 채 나무와 꽃을 가까이서 관찰할 수 있다. 숲으로 둘러싸인 호수 육림호 주변 산책로도 아름답다.수목원의 상징은 전나무 숲이다. 1927년 평창 월정사에서 가져온 씨앗으로 키운 묘목이 까마득한 높이로 자랐다. 은은하게 퍼지는 공기가 달고 시원하다. 피톤치드를 많이 배출하는 오전 10시부터 정오 사이가 삼림욕을 즐기기에 가장 좋다.광릉 들머리 숲길도 걸어볼 만하다. 광릉은 같은 산줄기의 좌우 언덕에 세조와 정희왕후 윤씨를 따로 모신 곳이다. 숲길은 광릉 재실에서 홍살문에 이르는 300여m의 짧은 구간으로, 수백년 된 키다리 전나무·소나무, 활엽수들이 울창한 숲을 이루고 있다. 평창 월정사, 부안 내소사와 함께 한국의 3대 전나무 숲길로 꼽힐 정도다.◇여행정보△가는길= 의정부로 간 뒤 포천 방향 43번 국도를 타고 축석고개 정상 축석검문소에서 우회전해 수목원 팻말 따라 10㎞쯤 가면 오른쪽에 정문이 나온다. 퇴계원 쪽에서 47번 국도 타고 가다 광릉 내에서 빠져나가 좌회전해서 가도 된다.△여행팁= 국립수목원은 지난달 29일부터 매주 화요일~일요일 6일간 개방한다. 입장객이 적은 12~2월 동절기에는 일요일에 문을 열지 않는다. 숲을 보호하기 위해 예약제로 운영한다. 홈페이지나 스마트폰 애플리케이션에서 예약할 수 있다. 평일 하루 5000명, 토·일요일은 3500명이 입장할 수 있다. 국립수목원을 더 많이 알고 싶다면 숲해설센터를 이용하자. 수목원에는 10~15명의 숲해설가가 활동하고 있다. 보통 1인이 20~30명(1회) 정도 인솔한다. 숲해설센터에서 신청하면 이용할 수 있다. 한 시간 정도 소요된다.강경록 (rock@edaily.co.kr)네이버 홈에서 ‘이데일리’ 뉴스 [구독하기▶] 꿀잼가득 [영상보기▶] , 청춘뉘우스~ [스냅타임▶]＜ⓒ종합 경제정보 미디어 이데일리 - 무단전재 & 재배포 금지＞","2019,10,11",https://news.naver.com/main/read.nhn?mode=LSD&mid=shm&sid1=103&oid=018&aid=0004487900,4,0,0,0,0,1,이데일리
