source,title,article_body,collect_time,link,good,nice,sad,angry,wanted,recommand,press
naver_news,8차 사건 '디테일' 알고 있던 이춘재…증거물 재감정,"동영상 뉴스[앵커]화성 연쇄살인사건 8차 사건도 자신이 저질렀다고 이춘재가 자백을 하면서 이 사건 범인으로 20년 옥살이를 한 윤모 씨는 재심을 준비하고 있고요, 약촌오거리 살인사건 등의 재심 변호사로 잘 알려져있는 박준영 변호사가 변호를 맡게 됐습니다. 정말 이춘재가 진범이냐는 논란이 계속되는 와중에 진짜 범인만 알 수 있는 의미있는 진술을 이춘재가 했다고 경찰이 밝혔습니다. 거의 남아있지는 않지만 8차 사건 증거물 분석작업이 지금 진행되고 있습니다.먼저 김도훈 기자입니다.[기자]이춘재는 화성 연쇄살인 사건 등 14건을 모두 자신이 저질렀다고 자백했습니다.당초 모방범죄로 이미 범인이 붙잡힌 8차 사건도 여기에 포함됩니다.당시 수사에 문제가 있던 것 아니냐는 논란이 일었습니다.그런데 최근 이춘재가 8차 사건과 관련해 의미있는 진술을 했습니다.경찰은 ""이춘재가 화성 8차 사건 범인이 붙잡혀 처벌받은 걸 알고 있다""며 ""진짜 8차 사건 범인이 아니면 알 수 없는 의미있는 내용도 진술했다""고 밝혔습니다.이 때문에 경찰은 먼저 과거 수사에 문제가 있었는지 살펴보고 있습니다.퇴직한 당시 경찰관들을 찾아가 조사 중입니다.하지만 증거물은 거의 남아 있지 않고 사건 기록도 사본만 있습니다.경찰은 현장에서 발견된 풀 한 포기가 남은 유일한 증거품이라며, 국과수에 감정을 신청했습니다.당시 진범으로 붙잡힌 윤모 씨는 이미 20년간 옥살이를 마치고 출소했습니다.윤씨는 과거 자신이 범인이라고 자백한 것은 가혹행위와 고문 때문이었다고 주장하고 있습니다.윤씨는 8차 사건에 대해 법원에 재심을 준비 중입니다.(영상디자인 : 곽세미)김도훈 기자 (kim.dohoon1@jtbc.co.kr) [영상취재: 최무룡 / 영상편집: 김지우]Copyright by JTBC(http://jtbc.joins.com) and JTBC Content Hub Co., Ltd. All Rights Reserved. 무단 전재 및 재배포 금지","2019,10,11",https://news.naver.com/main/read.nhn?mode=LSD&mid=shm&sid1=102&oid=437&aid=0000221642,0,0,1,1,0,0,JTBC
naver_news,철도노조 3일간 한시 파업 돌입…열차 감축에 이용객 불편 우려,"파업 하루 앞둔 10일 서울역 모습[연합뉴스 자료사진] 파업 하루 앞둔 10일 서울역 모습[연합뉴스 자료사진]철도노조 집회 모습[연합뉴스 자료사진] 철도노조 집회 모습[연합뉴스 자료사진]고속열차 80%·새마을호 60%·화물열차 36.8% 수준 운행4조 2교대제 내년 시행·총인건비 정상화·SR 통합 등 요구(대전=연합뉴스) 유의주 기자 = 전국철도노동조합이 11일 오전 9시부터 14일 오전 9시까지 3일간 한시 파업에 들어갔다.코레일은 철도노조 파업에 따라 KTX와 새마을호 등 여객열차와 화물열차를 20∼60%가량 감축 운행할 예정이어서 이용객 불편과 수출업계 화물 운송 차질이 우려된다.철도노조의 파업은 2016년 9∼12월 74일의 장기파업 이후 3년 만이다.철도 노사는 지난 5월 2019년 임금·단체교섭 시작 이후 4차례의 본교섭과 8차례의 실무교섭을 진행했지만, 합의에 이르지 못했다.노조는 지난 8월 21일 교섭 결렬을 선언하고, 9월 4∼6일 진행한 조합원 총회(쟁의행위 찬반투표)에서 73.4% 찬성률로 쟁의행위를 결정했다.노조는 ▲ 총인건비 정상화 ▲ 노동시간 단축과 철도안전을 위해 2020년 1월 1일부터 시행하기로 한 4조 2교대 근무 형태 도입을 위한 안전인력 충원 ▲ 생명안전업무 정규직화와 자회사 처우개선 등 노·사·전문가협의체 합의 이행을 요구하고 있다.철도 공공성 강화를 위한 철도 통합, 특히 올해 안 KTX-SRT 고속철도 통합도 요구한다.총인건비는 매년 기획재정부가 공공기관의 임금총액을 정하는 제도로, 노조는 총인건비가 비정상적으로 책정돼 연차보상이나 정률 수당 등이 지급되지 않는 상황이 반복되고 있다고 주장한다.이에 따라 수당을 정상화하고 임금도 4% 올려달라고 요구하고 있다.4조 2교대 전환은 현재 3조 2교대인 운전, 승무 등의 인력 운영을 주 52시간제 시행과 안전 확보를 위해 변경하자는 것으로, 2018년 노사합의에서 내년 1월 전면 시행에 합의했다고 노조는 주장했다.노조는 이런 요구가 수용되지 않으면 이번 한시 파업 이후 11월 중 본격적인 파업을 하겠다는 입장이다.사 측은 이에 대해 ""총인건비 정상화나 4조 2교대 근무를 위한 안전인력 충원은 코레일 차원에서 해결 가능한 사안이 아니며, 기재부와 국토교통부 등 정부 차원에서 논의가 필요한 사안""이라며 난색을 보이고 있다.국토교통부와 코레일은 파업 기간 광역전철은 평상시의 88.1%, 고속열차는 81.1%(KTX 72.4%·SRT 정상 운행) 수준으로 감축 운행할 방침이다.새마을·무궁화호 등 일반 열차는 60%, 화물열차는 36.8% 수준에서 운행한다.국토부는 코레일 직원과 군 인력 등 동원 가능한 대체 인력을 출퇴근 광역전철, KTX 등에 우선 투입해 열차 운행 횟수를 최대한 유지할 계획이다.고속버스·시외버스 등 대체 교통수단도 최대한 활용하고, 화물열차는 수출입 물품, 산업 필수품 등 긴급 화물 위주로 수송할 계획이다.코레일 관계자는 ""파업 기간 열차 운행이 중지되면 전액 환불해 드린다""며 ""예매한 열차의 운행 여부를 꼭 확인해 달라""고 당부했다.yej@yna.co.kr","2019,10,11",https://news.naver.com/main/read.nhn?mode=LSD&mid=shm&sid1=102&oid=001&aid=0011135579,1,1,0,52,0,4,연합뉴스
naver_news,"'동맹배신' 논란에 궁지 몰린 트럼프 ""터키와 쿠르드 중재 희망""","지난 9일(현지시간) 터키군 공격을 받은 시리아 국경도시[로이터=연합뉴스] 지난 9일(현지시간) 터키군 공격을 받은 시리아 국경도시[로이터=연합뉴스]트럼프 미국 대통령 - 에르도안 터키 대통령 (PG)[장현경 제작] 일러스트 트럼프 미국 대통령 - 에르도안 터키 대통령 (PG)[장현경 제작] 일러스트군사개입 대신 경제제재 강조하며 중재 피력…美 상하원도 제재법안 추진美관리 ""트럼프가 '정전합의' 중재임무 부여…민간인 공격·인종청소 용납안돼""(워싱턴=연합뉴스) 류지복 특파원 = 도널드 트럼프 미국 대통령은 10일(현지시간) 터키가 시리아 북동부 쿠르드족 장악지역을 공격한 것과 관련해 대(對) 터키 경제제재를 위협하며 쿠르드와의 중재에 나설 의향을 피력했다.트럼프 대통령의 시리아 북동부에 주둔한 미군 철수 지시와 뒤이은 터키의 쿠르드 공격으로 인해 이슬람국가(IS) 격퇴전에 함께 참여한 동맹인 쿠르드를 배신했다는 비난에 직면하며 궁지에 몰리자 국면 전환을 위해 중재 카드를 꺼내든 모양새다.트럼프 대통령은 이날 오후 트윗을 통해 우리는 (터키 대응에서) 세 가지 선택 중 하나를 갖고 있다고 밝혔다.구체적으로 ▲수천 명의 군대를 보내 군사적으로 이기는 방법 ▲경제적으로, 제재와 함께 터키를 매우 심하게 공격하는 방법 ▲터키와 쿠르드 간 합의를 중재하는 방법을 제시했다.트럼프 대통령이 중재 가능성을 언급한 것은 처음으로, 뒤이어 백악관에서 가진 기자들과 문답에서는 중재를 성사시키는 세 번째 방법을 가장 선호한다는 입장을 밝혔다고 로이터통신과 AP통신 등이 전했다.트럼프 대통령은 기자들에게 ""나는 (세 가지 선택 중) 마지막 것을 희망한다""며 ""나는 중재할 수 있기를 희망한다""고 말했다.그러면서 터키에 대해 실제로 두 가지 선택이 있다며 터키를 겨냥한 군사적 개입과 경제적 제재를 거론했다.그러나 트럼프 대통령은 ""미국민들은 우리가 군사력을 갖고 (시리아로) 되돌아가는 것을 원하지 않는다""며 군사적 개입에는 비중을 두지 않았다.대신 그는 ""터키에 경제적으로 매우 강력한 것을 하는 선택이 있다""며 ""우리는 쿠르드와 매우 좋은 관계를 갖고 있다. 중재할 수 있기를 희망한다""고 밝혔다.또 ""우리는 제재와 다른 경제적인 것들에 관해 매우 혹독한 어떤 일을 할 가능성이 있다""고 재차 말했다.트럼프 대통령의 말을 종합하면 강력한 경제 제재 카드를 통해 터키를 압박하면서 터키와 쿠르드 간 중재를 시도하려는 뜻으로 읽힌다.이와 관련, 공화당의 그레이엄 상원의원과 민주당의 크리스 반 홀렌 상원의원은 시리아를 침공한 터키를 제재하는 법안에 합의한 상태다.이 법안은 터키의 에너지 산업과 군사 분야를 목표로 삼고 있다. 아울러 레제프 타이이프 에르도안 터키 대통령을 포함해 터키 지도부에 대한 비자 발급 제한과 그들의 미국 내 자산에 대한 제재도 포함될 것으로 전해졌다.하원에서 수십명의 공화당 의원들도 이날 터키에 대한 제재를 부과하는 법안을 발의하겠다고 밝혔다고 로이터가 전했다.이와 관련, AFP통신은 트럼프 대통령이 미 외교관들에게 터키와 쿠르드 군대 간 '정전합의' 중재를 제시했다고 미 관리를 인용해 보도했다.이 관리는 ""우리는 양측간 공통점이 있는 영역이 있는지, 정전으로의 길을 발견할 방법이 있는지를 알아보라는 임무를 대통령으로부터 부여받았다""고 말했다.또 무분별한 민간인 공격과 쿠르드족에 대한 인종청소는 용납되지 않을 것이라고도 강조했다.트럼프 대통령은 지난 6일 에르도안 대통령과 통화한 뒤 미군의 안전을 우려해 북동부 시리아에 주둔한 미군 철수를 지시했는데, 이는 미국의 동맹인 쿠르드를 위험에 빠뜨린 배신이라는 비판론이 친정인 공화당에서도 터져 나왔다.이후 트럼프 대통령은 터키의 쿠르드 공격을 '나쁜 생각'이라고 지지하지 않는다는 입장을 밝히면서 쿠르드족에 피해가 갈 경우 터키의 경제를 쓸어버리겠다고 엄포를 놨다.AFp는 트럼프 대통령의 중재 언급에 대해 지금까지 시리아에서 미군과 함께 싸워온 쿠르드 전사의 운명에 관해 변화하는 태도에서 가장 최근의 전환이라고 말했다.jbryoo@yna.co.kr","2019,10,11",https://news.naver.com/main/read.nhn?mode=LSD&mid=shm&sid1=100&oid=001&aid=0011135645,0,1,0,28,0,1,연합뉴스
naver_news,"지방 현금부자, 강남 아파트 러시","/사진=뉴스1 /사진=뉴스1서울 강남에서 거래된 아파트 4개 중 1개는 지방의 ‘현금부자’들이 사들인 것으로 나타났다.11일 국회 국토교통위원회 소속 민경욱 자유한국당 의원이 국토교통부 자료를 조사한 결과 올 1∼8월 서울 강남구에서 거래된 아파트 2252가구 가운데 서울 외 거주자가 매입한 건수가 555가구(24.6%)를 차지했다.지방 거주자의 강남 아파트 매입비율은 2017년 22.6%에서 지난해 24.3%로 증가했다.강남4구(강남·서초·송파·강동)로 불리는 서초구는 서울 외 거주자의 아파트 매입비율이 2017년 18.4%에서 지난해 19%, 올해 20.7%까지 증가했다.강동구도 2017년 22.1%, 지난해 24.4%, 올해 24.6%로 치솟았다. 송파구는 2017년 21.7%, 지난해 25.7% 올랐다가 올해 23.1%로 하락했다.민 의원은 “민간택지 분양가상한제 시행 등 각종 규제에도 서울 집값이 계속 오르면서 지방 투자자의 강남 행렬을 부추길 수 있다”며 “신도시 보상금이 풀리면 지방의 더 많은 현금부자가 서울 아파트를 매입해 집값이 상승할 우려가 있다”고 지적했다.김노향 기자 merry@mt.co.kr","2019,10,11",https://news.naver.com/main/read.nhn?mode=LSD&mid=shm&sid1=101&oid=417&aid=0000458520,0,0,0,0,0,0,머니S
naver_news,"[부처 여론조사 반응]'세달째 1위' 복지부, '더 잘하자' 분위기 속 내년 사업 의욕","【세종=뉴시스】뉴시스-리얼미터 월간정례 2019년 9월 '대한민국 행정부 정책수행 평가 조사' 중 보건복지부. 2019.10.10. (그래픽=리얼미터 제공) photo@newsis.com 【세종=뉴시스】뉴시스-리얼미터 월간정례 2019년 9월 '대한민국 행정부 정책수행 평가 조사' 중 보건복지부. 2019.10.10. (그래픽=리얼미터 제공) photo@newsis.com【서울=뉴시스】이종철 기자 = 2일 서울 여의도 국회에서 열린 보건복지위원회 의 보건복지부 국정감사에서 박능후 장관이 답변을 하고 있다. 2019.10.02.jc4321@newsis.com 【서울=뉴시스】이종철 기자 = 2일 서울 여의도 국회에서 열린 보건복지위원회 의 보건복지부 국정감사에서 박능후 장관이 답변을 하고 있다. 2019.10.02.jc4321@newsis.com【세종=뉴시스】임재희 기자 = 뉴시스가 처음 시행한 정부부처 정책수행 평가 점수에서 7월부터 지난달까지 세달 연속 1위를 기록한 보건복지부 내부는 이번 결과를 '더 잘하라'는 의미로 받아들이는 분위기다. 아울러 내년도 사업 구상에 한껏 박차를 가할 동력이 생긴 것으로 보인다.11일 복지부의 한 관계자는 ""사기가 오르기도 했지만 한편으론 중앙부처 중 1등이란 자리가 부담되는 만큼 '계속 잘해야겠다'는 목소리가 내부에서 나온다""고 분위기를 전했다.복지부는 뉴시스가 여론조사 전문기관 리얼미터에 의뢰해 실시한 '2019년 9월 대한민국 행정부 정책수행 평가 조사'에서 100점 만점에 46.3점의 지지도를 얻어 18개 행정부처 중 가장 높은 점수를 기록했다.정책수행을 '잘하고 있다'는 긍정평가가 40.0%, '잘못하고 있다'는 부정평가가 41.9%로 부정적인 국민 평가가 높았지만 그 폭이 1.9%포인트에 불과해 100점 환산 점수에선 가장 좋은 점수를 받았다. 두번째로 높은 행정안전부와는 1점 차이가 났으며 전체 평균(41.4점)보다도 4.9점 높았다.이 관계자는 ""내년도 정부 예산안이 국회에 제출된 상황에서 곧 부서별로 내년도 사업계획을 짜게 되는데 향후 큰 방향이나 새로운 사업을 구상해보자는 분위기도 조성돼 있다""고 말했다.복지부는 기존에 추진해 오던 건강보험 보장성 강화대책(문재인케어) 외에도 9월 들어 아동수당 지급대상을 기존 만 6세 미만에서 7세 미만으로 확대하고 내년도 어린이집 보육지원 체계 개편, 500가구 이상 아파트 신축 시 국·공립 어린이집 설치 의무화 등 아동 복지 정책을 발표한 바 있다.해당 부서의 한 관계자는 ""이번 정부 들어 아동에 대한 복지를 보편적으로 확대하는 정책을 국민들께서 좋게 봐주시는 것 같다""며 ""애초 목적과 성과를 달성할 수 있도록 계속해서 국민들의 의견을 들으면서 정책을 추진하겠다""고 말했다.limj@newsis.com","2019,10,11",https://news.naver.com/main/read.nhn?mode=LSD&mid=shm&sid1=102&oid=003&aid=0009499484,0,0,0,4,0,0,뉴시스
naver_news,"lgg 유산균, 식전 or 식후 언제 먹어야 효과적?","lgg 유산균. /사진='내몸사용설명서' 방송캡처 lgg 유산균. /사진='내몸사용설명서' 방송캡처한편 유사균은 식사 후에 복용하는 것이 좋긴 하지만 큰 차이는 없는 것으로 알려졌다. 다만 공복에 먹어야 한다면 물을 한 컵 마신 뒤 복용하는 것이 효과적인 것으로 전해졌다.프로바이오틱스의 일종으로 알려진 LGG유산균. MBN '엄지의 제왕'에 방송된 LGG유산균은 '락토바실러스 람노서스 GG'라는 뜻으로 프로바이오틱스의 일종이다. 프로바이오틱스는 우리 몸의 유해균을 없애주고 이익균을 장까지 도달하게 하는 기능을 가지고 있다.이에 몸에 남아있는 독소도 제거해 준다. 프로바이오틱스에는 면역 활성과 소화관 내 균총 개선에 효과가 있는 균주 2종을 포함하고 있는데, 이 중 하나가 바로 LGG유산균인 것으로 알려졌다.3세대 유산균으로 불리는 대표 균주인 LGG의 경우 일본 도호쿠대학 이토 교수에 따르면 세포와 조직 표면에 달라붙는 단백질 선모가 발달되어 있어서 소장내 부착성을 높여 장 안에 잘 정착이 된다고 알려졌다.유산균에는 장까지 살아서 도달할 수 있는 내산성, 내담즙성이 강하면서 각각 소장, 대장, 위장 면역에 효능이 있는 LGG, BB-12, LA-5 균주가 담겨있다.김유림 기자 cocory0989@mt.co.kr","2019,10,11",https://news.naver.com/main/read.nhn?mode=LSD&mid=shm&sid1=103&oid=417&aid=0000458504,2,0,0,1,0,0,머니S
naver_news,"[해외 이모저모] '엄마, 뭐해요?' 뉴스 중 앵커 찾아온 4살아이","동영상 뉴스중국 장쑤성에서 고가도로가 무너지며 차량을 덮치는 사고가 일어났습니다. 차들이 달리고 있는데 갑자기 고가도로가 쓰러집니다. 미처 피할 새도 없이 차들은 그대로 깔려버렸습니다. 현지시간으로 10일, 바로 어제(10일) 저녁에 벌어진 사고인데요. 적어도 세대의 차가 깔린 것으로 알려졌는데, 다친 사람이 있는지는 아직 확인되지 않았습니다. 교통당국은 일단 사고 원인으로 고가를 지나던 과적 트럭에 주목하고 있는데요. 일각에선 이 고가도로가 22개월 만에 지어졌다며 부실공사 가능성을 강하게 제기하고 있습니다.현지시간 10일, 인도네시아의 안보 장관이 괴한이 휘두른 흉기에 찔렸습니다. 자바섬 판데그랑 지역에서 열린 한 행사에 참석한 장관을 향해 갑자기 괴한이 달려들더니 흉기로 복부를 찌른건데요. 장관은 긴급히 병원으로 옮겨져 수술을 받고, 현재 생명에는 지장이 없는 상태라고 합니다. 공격을 한 남성은 곧바로 경찰에 체포됐는데요. 이슬람 극단주의 무장단체 IS를 추종하는 인물인 것으로 밝혀졌습니다.미국 NBC 방송에서 뉴스 생방송 중 방송 사고가 났는데, 어쩐 일인지 응원이 이어지고 있다고 합니다. 생방송 중인 화면 한켠으로 해맑은 표정의 네 살 아이가 등장합니다. 현지시간 9일, 뉴스 진행 도중 방송사고가 난 장면인데요. 알고 보니 이 아이는 뉴스를 진행하던 앵커의 아들입니다. 속보 때문에 황급히 출근해야 했던 이 앵커, 쌍둥이 아이들을 미처 유치원에 데려다 주지 못하고 함께 스튜디오에 들어올 수 밖에 없었던 건데요. 사연이 알려지자 워킹맘인 앵커에게 응원이 이어지고 있다고 합니다.이곳은 미국 오하이오주의 한 가정집입니다. 집에 온 소년이 놀라 뛰쳐나오는데요. 다름 아닌, 염소 때문이었습니다. 이 염소, 집이 비어있는 사이 현관 유리를 깨고는 무단침입을 감행했는데요. 방을 누비며 자유를 만끽한 것도 잠시, 화장실에서 단잠을 자다가 딱 걸린 겁니다. 결국 경찰에게 붙잡혀 집에서 쫓겨났다고 합니다.미끄러지고 구르며 가파른 언덕을 내달립니다. 오스트리아에서 열린 경사면 달리기 대회인데요. 80도의 급경사에, 엎친 데 덮친 격으로 비까지 와 무척이나 미끄럽습니다. 참가자들은 넘어질 듯 말 듯 겅중겅중 코스를 달리는데요. 달리는 거리가 반, 구르는 거리가 반입니다. 치열한 대회 끝에 우승을 차지한 선수는 우리 돈으로 약 40만원 가량의 상금을 받았다고 합니다.Copyright by JTBC(http://jtbc.joins.com) and JTBC Content Hub Co., Ltd. All Rights Reserved. 무단 전재 및 재배포 금지","2019,10,11",https://news.naver.com/main/read.nhn?mode=LSD&mid=shm&sid1=104&oid=437&aid=0000221644,0,0,0,0,1,0,JTBC
naver_news,"[글로벌포스트] 美 SEC, 또다시 비트코인 ETF 승인 불허","■美 SEC, 비트와이즈 비트코인 ETF 승인 불허■中 알리페이·위챗페이, 비트코인 거래 금지■러시아 중앙은행, “CBDC 발행 고려 않아”■백트 거래량 7배 폭증, 선물 거래 회복세■암호화폐 시장 약보합세 … 비트코인 8500달러대9일(현지시간) 데일리호들에 따르면, 미국 증권거래위원회(SEC)가 비트와이즈가 신청한 비트코인 ETF 승인을 재심 끝내 다시 불허결정을 내렸다. SEC는 “비트와이즈가 시세 조작 금지를 위한 요건을 충족하지 못했다”면서 ETF 승인을 거절한다고 밝혔다. 바트와이즈는 이에 대해 “SEC의 신중한 검토에 감사한다”며 “SEC와의 협력을 통해 가능한 빠른 시일 내에 다시 승인 신청을 진행할 것”이라고 답했다.중국 모바일 결제 서비스인 알리페이가 10일(현지시간) 트위터를 통해 “정부 정책에 부응해 알리페이를 통한 일체의 비트코인 등 암호화폐 거래를 금지할 것”이라고 선언했다. 알리페이는 월 사용자수 5억명에 달하는 세계 최대의 모바일 결제 서비스다. 같은 날, 위챗페이도 암호화폐 거래 금지를 밝혔다. 위챗페이는 보도자료를 통해 “어떠한 형태의 암호화폐 거래도 위챗페이 상에서 지원하지 않을 것”이라고 밝혔다.러시아 중앙은행이 중앙은행 발행 디지털 통화(CBDC) 발행에 대해 부정적인 견해를 밝혔다. 10일(현지시간) 코인데스크에 따르면, 엘비라 나비울리나 러시아 중앙은행 총재는 러시아 타스 통신과의 인터뷰를 통해 “CBDC 필요성을 검토한 결과, 필요성이 충분치 않다는 결론을 내렸다”면서 “기술적인 문제 외에도 국가 통화 정책에 이득이 되지 않는다”고 말했다.거래량 부진으로 암호화폐 시장 전체에 악영향을 줬던 비트코인 선물거래 서비스 백트(Bakkt)가 최근 빠른 거래량 증가세를 보이고 있다고 비트코인익스체인지가이드가 10일(현지시간) 보도했다. 지난 9일 기준으로 백트의 거래량은 212BTC로 전일 대비 7배 이상 증가, 일일 최대 거래량을 기록했다. 코인마켓캡은 백트 거래량 증가가 비트코인 가격 상승과 맞물리고 있다면서 보다 장기적인 관점에서 비트코인 선물 거래 시장을 지켜볼 가치가 있다고 분석했다.11일 암호화폐 시장은 전날 상승세가 한풀 꺾인 모습이다. 오전 7시 코인360을 기준으로 비트코인은 하루 전과 비교해 0.08% 하락한 8545달러에 거래되고 있다. 이더리움은 0.31% 상승한 191달러, 리플은 2.48% 하락한 27센트, 라이트코인은 2.58% 하락한 57달러, 바이낸스코인은 3% 내려간 17.36달러, 비트코인캐시는 3.11% 하락한 230달러를 기록하고 있다. 시총 기준 톱10 암호화폐 중 이더리움을 제외한 모든 종목이 소폭 내림세를 기록하고 있다.※ 저작권자 ⓒ 파이낸셜뉴스. 무단 전재-재배포 금지","2019,10,11",https://news.naver.com/main/read.nhn?mode=LSD&mid=shm&sid1=105&oid=014&aid=0004308039,0,0,0,0,0,0,파이낸셜뉴스
